{
  "extract-components": "提取组件",
  "add-more-files": "添加更多文件",
  "sort-files-by-name": "按名称排序文件",
  "sort-ascending": "升序排序",
  "sort-descending": "降序排序",
  "delete-this-file": "删除此文件",
  "no-files-selected": "未选择任何文件",
  "files-loaded_one": "{{count}} 个文件已加载",
  "files-loaded_other": "{{count}} 个文件已加载",
  "processing-files": "正在处理 {{count}} 个文件..."
}
